{
  "$schema": "https://json-schema.org/draft/2020-12/schema",
  "title": "External Report Reference Manifest",
  "type": "object",
  "additionalProperties": false,
  "required": [
    "$schema",
    "artifact_kind",
    "generated_at",
    "producer",
    "source_command",
    "source_revision",
    "source_tree_fingerprint",
    "input_fingerprints",
    "schema_version",
    "artifact_status",
    "retention_policy",
    "encoding",
    "currentness",
    "vault",
    "policy",
    "review_basis_zip",
    "current_distribution_zip",
    "basis_zip",
    "distribution_provenance",
    "active_reference_set",
    "archive_exclusion_policy",
    "excluded_file_count",
    "summary",
    "references"
  ],
  "properties": {
    "$schema": { "type": "string", "enum": ["ops/schemas/external-report-reference-manifest.schema.json"] },
    "artifact_kind": { "type": "string", "enum": ["external_report_reference_manifest"] },
    "generated_at": { "type": "string", "pattern": "^\\d{4}-\\d{2}-\\d{2}T\\d{2}:\\d{2}:\\d{2}Z$" },
    "producer": { "type": "string", "enum": ["ops.scripts.external_report_reference_manifest"] },
    "source_command": { "type": "string", "minLength": 1 },
    "source_revision": { "type": "string", "minLength": 1 },
    "source_tree_fingerprint": { "type": "string", "minLength": 1 },
    "input_fingerprints": {
      "type": "object",
      "additionalProperties": { "type": "string", "minLength": 1 }
    },
    "schema_version": { "type": "integer", "minimum": 1 },
    "artifact_status": { "type": "string", "enum": ["current", "archived", "stale", "unknown"] },
    "retention_policy": { "type": "string", "enum": ["canonical_report"] },
    "encoding": { "type": "string", "enum": ["utf-8"] },
    "currentness": {
      "type": "object",
      "additionalProperties": false,
      "required": ["status", "checked_at"],
      "properties": {
        "status": { "type": "string", "enum": ["current", "stale", "unknown", "invalid"] },
        "checked_at": { "type": "string", "pattern": "^\\d{4}-\\d{2}-\\d{2}T\\d{2}:\\d{2}:\\d{2}Z$" }
      }
    },
    "vault": { "type": "string" },
    "policy": {
      "type": "object",
      "additionalProperties": false,
      "required": ["path", "version"],
      "properties": {
        "path": { "type": "string", "minLength": 1 },
        "version": { "type": ["integer", "string", "null"] }
      }
    },
    "review_basis_zip": {
      "$ref": "#/$defs/zip_identity"
    },
    "current_distribution_zip": {
      "$ref": "#/$defs/zip_identity"
    },
    "basis_zip": {
      "$ref": "#/$defs/zip_identity"
    },
    "distribution_provenance": {
      "type": "object",
      "additionalProperties": false,
      "required": [
        "mode",
        "status",
        "basis_zip_matches_current_distribution",
        "identity_mismatch_fields",
        "name_mismatch"
      ],
      "properties": {
        "mode": { "type": "string", "enum": ["advisory", "strict_review_release"] },
        "status": {
          "type": "string",
          "enum": [
            "current_distribution_missing",
            "basis_zip_missing",
            "basis_current_match",
            "basis_current_mismatch"
          ]
        },
        "basis_zip_matches_current_distribution": { "type": ["boolean", "null"] },
        "identity_mismatch_fields": {
          "type": "array",
          "items": { "type": "string", "enum": ["sha256", "entry_count"] },
          "uniqueItems": true
        },
        "name_mismatch": { "type": "boolean" }
      }
    },
    "active_reference_set": {
      "type": "object",
      "additionalProperties": false,
      "required": [
        "status",
        "previous_report_count",
        "current_report_count",
        "added_paths",
        "removed_paths"
      ],
      "properties": {
        "status": {
          "type": "string",
          "enum": ["current", "drift", "no_prior_manifest", "unreadable_prior_manifest"]
        },
        "previous_report_count": { "type": ["integer", "null"], "minimum": 0 },
        "current_report_count": { "type": "integer", "minimum": 0 },
        "added_paths": {
          "type": "array",
          "items": { "type": "string", "minLength": 1 },
          "uniqueItems": true
        },
        "removed_paths": {
          "type": "array",
          "items": { "type": "string", "minLength": 1 },
          "uniqueItems": true
        }
      }
    },
    "archive_exclusion_policy": { "type": "string", "minLength": 1 },
    "excluded_file_count": { "type": "integer", "minimum": 0 },
    "summary": {
      "type": "object",
      "additionalProperties": false,
      "required": [
        "report_count",
        "basis_zip_known",
        "review_basis_zip_known",
        "current_distribution_zip_known",
        "basis_zip_matches_current_distribution",
        "zip_provenance_status",
        "active_reference_set_status",
        "archive_included",
        "excluded_file_count"
      ],
      "properties": {
        "report_count": { "type": "integer", "minimum": 0 },
        "basis_zip_known": { "type": "boolean" },
        "review_basis_zip_known": { "type": "boolean" },
        "current_distribution_zip_known": { "type": "boolean" },
        "basis_zip_matches_current_distribution": { "type": ["boolean", "null"] },
        "zip_provenance_status": {
          "type": "string",
          "enum": [
            "current_distribution_missing",
            "basis_zip_missing",
            "basis_current_match",
            "basis_current_mismatch"
          ]
        },
        "active_reference_set_status": {
          "type": "string",
          "enum": ["current", "drift", "no_prior_manifest", "unreadable_prior_manifest"]
        },
        "archive_included": { "type": "boolean" },
        "excluded_file_count": { "type": "integer", "minimum": 0 }
      }
    },
    "references": {
      "type": "array",
      "items": {
        "type": "object",
        "additionalProperties": false,
        "required": [
          "path",
          "storage_path",
          "display_name",
          "path_aliases",
          "sha256",
          "content_sha256",
          "byte_count",
          "line_count",
          "evidence_role",
          "normalization_form",
          "escape_diagnostics"
        ],
        "properties": {
          "path": { "type": "string", "minLength": 1 },
          "storage_path": { "type": "string", "minLength": 1 },
          "display_name": { "type": "string", "minLength": 1 },
          "path_aliases": {
            "type": "array",
            "minItems": 1,
            "items": { "type": "string", "minLength": 1 },
            "uniqueItems": true
          },
          "sha256": { "type": "string", "pattern": "^[a-f0-9]{64}$" },
          "content_sha256": { "type": "string", "pattern": "^[a-f0-9]{64}$" },
          "byte_count": { "type": "integer", "minimum": 0 },
          "line_count": { "type": ["integer", "null"], "minimum": 0 },
          "evidence_role": {
            "type": "string",
            "enum": ["test_structure_review", "release_review", "active_external_report"]
          },
          "normalization_form": {
            "type": "string",
            "enum": ["NFC", "non_nfc"]
          },
          "escape_diagnostics": {
            "type": "object",
            "additionalProperties": false,
            "required": [
              "display_path",
              "archive_path",
              "escape_expanded_diagnostic_path",
              "utf8_path_bytes",
              "python_unicode_escape_filename_bytes",
              "posix_escape_expanded_filename_bytes",
              "infozip_c_locale_escape_filename_bytes"
            ],
            "properties": {
              "display_path": { "type": "string", "minLength": 1 },
              "archive_path": { "type": "string", "minLength": 1 },
              "escape_expanded_diagnostic_path": { "type": "string", "minLength": 1 },
              "utf8_path_bytes": { "type": "integer", "minimum": 1 },
              "python_unicode_escape_filename_bytes": { "type": "integer", "minimum": 1 },
              "posix_escape_expanded_filename_bytes": { "type": "integer", "minimum": 1 },
              "infozip_c_locale_escape_filename_bytes": { "type": "integer", "minimum": 1 }
            }
          }
        }
      }
    }
  },
  "$defs": {
    "zip_identity": {
      "type": "object",
      "additionalProperties": false,
      "required": ["name", "sha256", "entry_count", "source"],
      "properties": {
        "name": { "type": "string" },
        "sha256": {
          "type": "string",
          "anyOf": [
            { "const": "" },
            { "pattern": "^[a-f0-9]{64}$" }
          ]
        },
        "entry_count": { "type": ["integer", "null"], "minimum": 0 },
        "source": { "type": "string", "enum": ["computed", "reported", "unspecified"] }
      }
    }
  }
}
