{
  "$schema": "ops/schemas/external-report-reference-manifest.schema.json",
  "artifact_kind": "external_report_reference_manifest",
  "generated_at": "2026-05-20T16:56:47Z",
  "producer": "ops.scripts.external_report_reference_manifest",
  "source_command": "python -m ops.scripts.external_report_reference_manifest --vault . --out external-reports/report-reference-manifest.json",
  "source_revision": "unknown",
  "source_tree_fingerprint": "ac46b5999a4ffeeda7ba9d12e642f0a3a8ebbcb21484279381042a613041f99f",
  "input_fingerprints": {
    "policy": "db4a14398a7f56012e4809c9641e5272afd043bf7bd0f600e794266123b0ec24",
    "schema": "1d6f04ca255e308a81818f56c8abffc20fb6bd6b56145cbde9dbed29b1637437",
    "artifact_envelope_schema": "87fcb7b91ffc04e8180c1c3e51e309cde186ecf23f91f7974a541d0b580976de",
    "source_paths": "6da186ae7de647a7a24cf53aa44e0f4507522e360f6229d505e76d1ec154890c",
    "external_reports": "6365edbf63aa59004ea72144324122a5d1d302e0072a3165ba5404c56c02b28b",
    "active_reference_set_status": "97b0560280ed60a5a1eaa1bc45492543c8a986ad5a25b468c427eb83c3e88191",
    "basis_zip_entry_count": "e3b0c44298fc1c149afbf4c8996fb92427ae41e4649b934ca495991b7852b855",
    "basis_zip_name": "e3b0c44298fc1c149afbf4c8996fb92427ae41e4649b934ca495991b7852b855",
    "basis_zip_sha256": "e3b0c44298fc1c149afbf4c8996fb92427ae41e4649b934ca495991b7852b855",
    "current_distribution_zip_entry_count": "e3b0c44298fc1c149afbf4c8996fb92427ae41e4649b934ca495991b7852b855",
    "current_distribution_zip_name": "e3b0c44298fc1c149afbf4c8996fb92427ae41e4649b934ca495991b7852b855",
    "current_distribution_zip_sha256": "e3b0c44298fc1c149afbf4c8996fb92427ae41e4649b934ca495991b7852b855",
    "mode": "644c4a77ffa6df24068f109ef2582ea1a76cc24b42eef9ed6b9efef0af0db69d",
    "zip_provenance_status": "faca0cb79fa7bae7ae3a44842b4937304d3dc00b8a3b1fd894b1839aa0318e9b"
  },
  "schema_version": 1,
  "artifact_status": "current",
  "retention_policy": "canonical_report",
  "encoding": "utf-8",
  "currentness": {
    "status": "current",
    "checked_at": "2026-05-20T16:56:47Z"
  },
  "vault": ".",
  "policy": {
    "path": "ops/policies/wiki-maintainer-policy.yaml",
    "version": 4
  },
  "review_basis_zip": {
    "name": "",
    "sha256": "",
    "entry_count": null,
    "source": "unspecified"
  },
  "current_distribution_zip": {
    "name": "",
    "sha256": "",
    "entry_count": null,
    "source": "unspecified"
  },
  "basis_zip": {
    "name": "",
    "sha256": "",
    "entry_count": null,
    "source": "unspecified"
  },
  "distribution_provenance": {
    "mode": "advisory",
    "status": "current_distribution_missing",
    "basis_zip_matches_current_distribution": null,
    "identity_mismatch_fields": [],
    "name_mismatch": false
  },
  "active_reference_set": {
    "status": "current",
    "previous_report_count": 1,
    "current_report_count": 1,
    "added_paths": [],
    "removed_paths": []
  },
  "archive_exclusion_policy": "external-reports/archive is excluded from active reference provenance; root external-reports files are the operator-facing evidence set",
  "excluded_file_count": 70,
  "summary": {
    "report_count": 1,
    "basis_zip_known": false,
    "review_basis_zip_known": false,
    "current_distribution_zip_known": false,
    "basis_zip_matches_current_distribution": null,
    "zip_provenance_status": "current_distribution_missing",
    "active_reference_set_status": "current",
    "archive_included": false,
    "excluded_file_count": 70
  },
  "references": [
    {
      "path": "external-reports/llmwiki_code_change_implementation_report_20260516.md",
      "storage_path": "external-reports/llmwiki_code_change_implementation_report_20260516.md",
      "display_name": "llmwiki_code_change_implementation_report_20260516.md",
      "path_aliases": [
        "external-reports/llmwiki_code_change_implementation_report_20260516.md"
      ],
      "sha256": "560f906d67d1fbb9f72ca19058f7774a5a62d3c6d9e1ca5b666c3a034d0cbcfc",
      "content_sha256": "560f906d67d1fbb9f72ca19058f7774a5a62d3c6d9e1ca5b666c3a034d0cbcfc",
      "byte_count": 30081,
      "line_count": 790,
      "evidence_role": "active_external_report",
      "normalization_form": "NFC",
      "escape_diagnostics": {
        "display_path": "external-reports/llmwiki_code_change_implementation_report_20260516.md",
        "archive_path": "external-reports/llmwiki_code_change_implementation_report_20260516.md",
        "escape_expanded_diagnostic_path": "external-reports/llmwiki_code_change_implementation_report_20260516.md",
        "utf8_path_bytes": 70,
        "python_unicode_escape_filename_bytes": 53,
        "posix_escape_expanded_filename_bytes": 53,
        "infozip_c_locale_escape_filename_bytes": 53
      }
    }
  ]
}
